{
  "$schema": "https://json-schema.org/draft/2020-12/schema",
  "$id": "https://kmin-video-director.invalid/schemas/2.0.0/spatial_transform.schema.json",
  "type": "object",
  "properties": {
    "id": {
      "type": "string",
      "minLength": 1,
      "maxLength": 96,
      "pattern": "^[^\\x00-\\x1f\\x7f]+(?![\\s\\S])"
    },
    "version": {
      "type": "string",
      "minLength": 1,
      "maxLength": 96,
      "pattern": "^[^\\x00-\\x1f\\x7f]+(?![\\s\\S])"
    },
    "coded_width": {
      "type": "integer",
      "minimum": 1,
      "maximum": 9007199254740991
    },
    "coded_height": {
      "type": "integer",
      "minimum": 1,
      "maximum": 9007199254740991
    },
    "source_sar": {
      "type": "object",
      "properties": {
        "num": {
          "type": "integer",
          "minimum": -9007199254740991,
          "maximum": 9007199254740991
        },
        "den": {
          "type": "integer",
          "minimum": 1,
          "maximum": 9007199254740991
        }
      },
      "required": [
        "num",
        "den"
      ],
      "additionalProperties": false
    },
    "display_matrix": {
      "type": "array",
      "items": {
        "type": "number"
      }
    },
    "display_width": {
      "type": "integer",
      "minimum": 1,
      "maximum": 9007199254740991
    },
    "display_height": {
      "type": "integer",
      "minimum": 1,
      "maximum": 9007199254740991
    },
    "scale": {
      "type": "object",
      "properties": {
        "num": {
          "type": "integer",
          "minimum": -9007199254740991,
          "maximum": 9007199254740991
        },
        "den": {
          "type": "integer",
          "minimum": 1,
          "maximum": 9007199254740991
        }
      },
      "required": [
        "num",
        "den"
      ],
      "additionalProperties": false
    },
    "fitted_width": {
      "type": "integer",
      "minimum": 1,
      "maximum": 9007199254740991
    },
    "fitted_height": {
      "type": "integer",
      "minimum": 1,
      "maximum": 9007199254740991
    },
    "canvas_width": {
      "type": "integer",
      "minimum": 1,
      "maximum": 9007199254740991
    },
    "canvas_height": {
      "type": "integer",
      "minimum": 1,
      "maximum": 9007199254740991
    },
    "content_rect": {
      "type": "object",
      "properties": {
        "x": {
          "type": "integer",
          "minimum": 0,
          "maximum": 9007199254740991
        },
        "y": {
          "type": "integer",
          "minimum": 0,
          "maximum": 9007199254740991
        },
        "width": {
          "type": "integer",
          "minimum": 1,
          "maximum": 9007199254740991
        },
        "height": {
          "type": "integer",
          "minimum": 1,
          "maximum": 9007199254740991
        }
      },
      "required": [
        "x",
        "y",
        "width",
        "height"
      ],
      "additionalProperties": false
    },
    "pad_fill": {
      "type": "object"
    },
    "resampler": {
      "type": "string",
      "minLength": 1,
      "maxLength": 96,
      "pattern": "^[^\\x00-\\x1f\\x7f]+(?![\\s\\S])"
    },
    "color_conversion": {
      "type": "string",
      "minLength": 1,
      "maxLength": 96,
      "pattern": "^[^\\x00-\\x1f\\x7f]+(?![\\s\\S])"
    },
    "output_width": {
      "type": "integer",
      "minimum": 1,
      "maximum": 9007199254740991
    },
    "output_height": {
      "type": "integer",
      "minimum": 1,
      "maximum": 9007199254740991
    },
    "output_sar": {
      "type": "object",
      "properties": {
        "num": {
          "type": "integer",
          "minimum": -9007199254740991,
          "maximum": 9007199254740991
        },
        "den": {
          "type": "integer",
          "minimum": 1,
          "maximum": 9007199254740991
        }
      },
      "required": [
        "num",
        "den"
      ],
      "additionalProperties": false
    }
  },
  "required": [
    "id",
    "version",
    "coded_width",
    "coded_height",
    "source_sar",
    "display_matrix",
    "display_width",
    "display_height",
    "scale",
    "fitted_width",
    "fitted_height",
    "canvas_width",
    "canvas_height",
    "content_rect",
    "pad_fill",
    "resampler",
    "color_conversion",
    "output_width",
    "output_height",
    "output_sar"
  ],
  "additionalProperties": false
}
